"10.1007/s10802-022-00946-w",2022,"Research on Child and Adolescent Psychopathology","2730-7166",1.468,2,"United States","United States","United States","Child and Adolescent Psychosocial and Emotional Development","https://openalex.org/T10182",NA,NA,NA,"Eunice Kennedy Shriver National Institute of Child Health and Human Development","10.13039/100009633","R21HD091887 || T32HD101390","The authors declare that they have no competing or conflicts of interests. || Conflict of Interest",NA,list(id = "https://openalex.org/T10182", display_name = "Child and Adolescent Psychosocial and Emotional Development", score = 0.998099982738495, subfield = list(id = "https://openalex.org/subfields/3203", display_name = "Clinical Psychology"), field = list(id = "https://openalex.org/fields/32", display_name = "Psychology"), domain = list(id = "https://openalex.org/domains/2", display_name = "Social Sciences")),"Pennsylvania State University, United States","University of Rochester, United States","Pennsylvania State University, United States","https://openalex.org/I130769515","Pennsylvania State University","education","US","United States",NA,NA,NA,NA,"article","https://openalex.org/I5388228","University of Rochester","education","US","United States",NA,NA,NA,NA,"author-profile","https://openalex.org/I130769515","Pennsylvania State University","education","US","United States",NA,NA,NA,NA,"author-profile","11/17/2025 14:04:49","JB","10.1007/s10802-022-00946-w","They basically ran practice sessions and called them pilots (which is something I have also encountered, like the last test run prior to starting a study is often referred to as a pilot)","""Prior to initiation of the trial, clinicians rehearsed integrating dogs into delivery of TF-CBT during mock pilot sessions with volunteer children 6 to 17 years of age who were not part of the trial."" (but that is all that is in the article)","","","","","","","","","","","","","","","","","","","","","","","","","","","","","","","","","","","","","3 minutes"
"10.1111/cdev.13853",2022,"Child Development","0009-3920",2.135,7,"United States","United States","United States","Racial and Ethnic Identity Research","https://openalex.org/T10652",NA,NA,NA,"Eunice Kennedy Shriver National Institute of Child Health and Human Development","10.13039/100009633","2R01 HD075311",NA,"<jats:title>Abstract</jats:title>
                  <jats:p>Guided by the Theory of Racial Socialization in Action (TRSA; Smith-Bynum in press), this study examined observed caregiver-provided ethnic-racial socialization in response to a school-based discriminatory dilemma. Forty-five Black and 36 Latinx caregivers (88% mothers) with low-income and their children (Mage = 11.09, SD = 0.29; 46.3% female) participated in Dallas, Texas from 2018 to 2019. Dyads responded to a hypothetical scenario in which a school counselor makes a discriminatory comment to the child. Results of a factor mixture analysis suggested that caregivers engaged in the dialogue using one of four approaches: Low-engaged, Legacy, Racial Literacy, or High-engaged. Profiles were found to differ significantly by the race/ethnicity and language of caregivers and were associated with youth’s concurrent behavioral engagement (R2 = .04).</jats:p>",list(id = "https://openalex.org/T10652", display_name = "Racial and Ethnic Identity Research", score = 0.998700022697449, subfield = list(id = "https://openalex.org/subfields/3312", display_name = "Sociology and Political Science"), field = list(id = "https://openalex.org/fields/33", display_name = "Social Sciences"), domain = list(id = "https://openalex.org/domains/2", display_name = "Social Sciences")),"University of Georgia, United States","Harford Research Institute, United States","University of Georgia, United States","https://openalex.org/I165733156","University of Georgia","education","US","United States",NA,NA,NA,NA,"article","https://openalex.org/I4210123883","Harford Research Institute","facility","US","United States",NA,NA,NA,NA,"author-profile","https://openalex.org/I165733156","University of Georgia","education","US","United States",NA,NA,NA,NA,"author-profile","11/17/2025 14:06:25","JB","10.1111/cdev.13853","No, there is no statement that a pilot study was conducted","Refering to previous studies (e.g. ""a small pilot study yielded similar findings in children with ASD (Chong et al., 2021).""","","","","","","","","","","","","","","","","","","","","","","","","","","","","","","","","","","","","","2 minutes"
"10.3758/s13428-021-01719-x",2022,"Behavior Research Methods","1554-351X",2.753,7,"Cyprus","Cyprus","Cyprus","Psychological and Educational Research Studies","https://openalex.org/T14308",NA,NA,NA,NA,NA,NA,NA,NA,list(id = "https://openalex.org/T14308", display_name = "Psychological and Educational Research Studies", score = 0.97979998588562, subfield = list(id = "https://openalex.org/subfields/3205", display_name = "Experimental and Cognitive Psychology"), field = list(id = "https://openalex.org/fields/32", display_name = "Psychology"), domain = list(id = "https://openalex.org/domains/2", display_name = "Social Sciences")),"University of Cyprus, Cyprus","University of Cyprus, Cyprus","University of Cyprus, Cyprus","https://openalex.org/I34771391","University of Cyprus","education","CY","Cyprus",NA,NA,NA,NA,"article","https://openalex.org/I34771391","University of Cyprus","education","CY","Cyprus",NA,NA,NA,NA,"author-profile","https://openalex.org/I34771391","University of Cyprus","education","CY","Cyprus",NA,NA,NA,NA,"author-profile","11/17/2025 14:08:47","JB","10.3758/s13428-021-01719-x","No, there is no statement that a pilot study was conducted","It is suggested for future studies in the discussion: ""The use of subjective ratings in a pilot study for the evaluation of the adjectives in terms of valence, arousal, frequency, familiarity, ambiguity, and syllable length could strengthen the validity of the instrument scores.""","","","","","","","","","","","","","","","","","","","","","","","","","","","","","","","","","","","","","2 minutes"
"10.1002/eat.23726",2022,"International Journal of Eating Disorders","0276-3478",1.468,8,"United States","United States","United States","Eating Disorders and Behaviors","https://openalex.org/T10263",NA,NA,NA,"National Eating Disorders Association || University of North Carolina at Chapel Hill || National Science Foundation of Sri Lanka || National Institute of Mental Health || Brain and Behavior Research Foundation","10.13039/100003979 || 10.13039/100007890 || 10.13039/501100008982 || 10.13039/100000025 || 10.13039/100000874","DGE‐1650116 || R01MH119084 || U01 MH109528 || NARSAD Distinguished Investigator Grant",NA,"<jats:title>Abstract</jats:title><jats:sec><jats:title>Objective</jats:title><jats:p>Using preliminary data from the Binge‐Eating Genetics Initiative (BEGIN), we evaluated the feasibility of delivering an eating disorder digital app, <jats:italic>Recovery Record,</jats:italic> through smartphone and wearable technology for individuals with binge‐type eating disorders.</jats:p></jats:sec><jats:sec><jats:title>Methods</jats:title><jats:p>Participants (<jats:italic>n</jats:italic> = 170; 96% female) between 18 and 45 years old with lived experience of binge‐eating disorder or bulimia nervosa and current binge‐eating episodes were recruited through the <jats:italic>Recovery Record</jats:italic> app. They were randomized into a Watch (first‐generation Apple Watch + iPhone) or iPhone group; they engaged with the app over 30 days and completed baseline and endpoint surveys. Retention, engagement, and associations between severity of illness and engagement were evaluated.</jats:p></jats:sec><jats:sec><jats:title>Results</jats:title><jats:p>Significantly more participants in the Watch group completed the study (<jats:italic>p</jats:italic> = .045); this group had greater engagement than the iPhone group (<jats:italic>p</jats:italic>'s &lt; .05; pseudo‐<jats:italic>R</jats:italic><jats:sup>2</jats:sup><jats:sub>McFadden</jats:sub> effect size = .01–.34). Overall, binge‐eating episodes, reported for the previous 28 days, were significantly reduced from baseline (mean = 12.3) to endpoint (mean = 6.4): most participants in the Watch (60%) and iPhone (66%) groups reported reduced binge‐eating episodes from baseline to endpoint. There were no significant group differences across measures of binge eating. In the Watch group, participants with fewer episodes of binge eating at baseline were more engaged (<jats:italic>p</jats:italic>'s &lt; .05; pseudo‐<jats:italic>R</jats:italic><jats:sup>2</jats:sup><jats:sub>McFadden</jats:sub> = .01–.02). Engagement did not significantly predict binge eating at endpoint nor change in binge‐eating episodes from baseline to endpoint for both the Watch and iPhone groups.</jats:p></jats:sec><jats:sec><jats:title>Discussion</jats:title><jats:p>Using wearable technology alongside iPhones to deliver an eating disorder app may improve study completion and app engagement compared with using iPhones alone.</jats:p></jats:sec>",list(id = "https://openalex.org/T10263", display_name = "Eating Disorders and Behaviors", score = 1, subfield = list(id = "https://openalex.org/subfields/3203", display_name = "Clinical Psychology"), field = list(id = "https://openalex.org/fields/32", display_name = "Psychology"), domain = list(id = "https://openalex.org/domains/2", display_name = "Social Sciences")),"University of North Carolina at Chapel Hill, United States","University of North Carolina at Chapel Hill, United States","University of North Carolina at Chapel Hill, United States","https://openalex.org/I114027177","University of North Carolina at Chapel Hill","education","US","United States",NA,NA,NA,NA,"article","https://openalex.org/I114027177","University of North Carolina at Chapel Hill","education","US","United States",NA,NA,NA,NA,"author-profile","https://openalex.org/I114027177","University of North Carolina at Chapel Hill","education","US","United States",NA,NA,NA,NA,"author-profile","11/17/2025 14:32:11","JB","10.1002/eat.23726","Yes, the article states that there was a pilot study","","No","Registered at ClinicalTrials.gov","1","Empirical study(ies)","Quantitative observational study, Randomized Controlled Trial (RCT)","The entire article is about the report of a feasibility study.","“Feasibility” (study, experiment, test or similar)","It is just one feasibility study per se","","Objective: Using preliminary data from the Binge-Eating Genetics Initiative (BEGIN),  we evaluated the feasibility of delivering an eating disorder digital app, Recovery  Record, through smartphone and wearable technology for individuals with binge-type  eating disorders.",NA,"170",NA,"Participants in the feasibility study  were only recruited through the RR mobile app downloaded via the  Apple AppStore; recruitment was not limited to new users.",NA,""," ""individuals recruited for the feasibility study are  included in the parent study.""; ""Results of the feasibility study encouraged launching the parent study  to gather 30-days of RR data and passively collected data on actigraphy and heart rate from Apple Watches.""","Yes","Upon request from the authors","No","No (GO TO NEXT SECTION)","","","No (GO TO NEXT SECTION)","","","Yes","The entire results section.","Yes, both data and results (the data and results from the pilot were combined with the main study data and results).","Results of the feasibility study encouraged launching the parent study  to gather 30-days of RR data and passively collected data on  actigraphy and heart rate from Apple Watches.","","Foundation of Hope, Raleigh, North Carolina (Bulik, PI); National Eating Disorders Association. (Bulik and Tregarthen, PIs); Brain and Behavior Research Foundation (NARSAD Distinguished. Investigator Grant; Bulik, PI); National Institute of Mental Health (R01MH119084, Bulik/Butner, MPIs; R01MH124871, Sullivan/Bulik, MPIs); uBiome (services grant, Bulik, PI); National. Science Foundation (DGE-1650116; Flatt, PI). Any opinions, findings, and conclusions or recommendations expressed in this material are those of the author(s) and do not necessarily reflect the views of the National Science Foundation. Apple Watches were provided to University of North Carolina at Chapel Hill by Apple Inc. at no. cost to the study. No funding bodies were involved in the design of the study and collection, analysis, interpretation of data, or writing the manuscript.","Yes, the statement says that there are one or more conflicts of interest","Cynthia M. Bulik reports: Shire (grant recipient, Scientific Advisory  Board member); Idorsia (consultant); Pearson (author, royalty recipient); Equip Health Inc. (Clinical Advisory Board). Jenna Tregarthen  reports: Recovery Record (shareholder, employee).","No","","10 minutes"
"10.1111/jopy.12785",2022,"Journal of Personality","0022-3506",2.192,20,"Germany","Denmark","Germany","Personality Traits and Psychology","https://openalex.org/T11040",NA,NA,NA,"Danmarks Frie Forskningsfond","10.13039/501100004836",NA,NA,"<jats:title>Abstract</jats:title><jats:sec><jats:title>Objective</jats:title><jats:p>To explain and predict unethical behavior, much attention has been devoted to the “Dark Triad of Personality”, a set of three socially aversive personality traits: Machiavellianism, narcissism, and psychopathy. Despite its popularity, research on the Dark Triad has been beset by recurring concerns surrounding the distinctiveness of its components. Herein, we propose an alternative theoretical view that conceptualizes the Dark Triad traits as specific manifestations of the common core of aversive traits (conceptualized as the Dark Factor of Personality, D) flavored by unique, essentially non‐aversive characteristics.</jats:p></jats:sec><jats:sec><jats:title>Method</jats:title><jats:p>In two studies (total <jats:italic>N</jats:italic> &gt; 1000), we test this idea by examining the conceptual and empirical overlap and specificity of the Dark Triad traits vis‐à‐vis D and each other.</jats:p></jats:sec><jats:sec><jats:title>Results</jats:title><jats:p>Findings support the conceptualization of the Dark Triad traits as flavored manifestations of D and also reveal a marked discrepancy between the current conceptualization of the Dark Triad traits and the empirical structure of its subdimensions. In fact, evidence clearly failed to support the existence of a triad of traits.</jats:p></jats:sec><jats:sec><jats:title>Conclusion</jats:title><jats:p>Conceptualizing single aversive traits as a conjunction of core D aspects and essentially non‐aversive characteristics (admiration; disinhibition vs. planfulness; vulnerability vs. boldness) holds promise to move the field forward.</jats:p></jats:sec>",list(id = "https://openalex.org/T11040", display_name = "Personality Traits and Psychology", score = 0.999499976634979, subfield = list(id = "https://openalex.org/subfields/3203", display_name = "Clinical Psychology"), field = list(id = "https://openalex.org/fields/32", display_name = "Psychology"), domain = list(id = "https://openalex.org/domains/2", display_name = "Social Sciences")),"Universität Ulm, Germany","University of Copenhagen, Denmark","Universität Ulm, Germany","https://openalex.org/I196349391","Universität Ulm","education","DE","Germany",NA,NA,NA,NA,"article","https://openalex.org/I124055696","University of Copenhagen","education","DK","Denmark",NA,NA,NA,NA,"author-profile","https://openalex.org/I196349391","Universität Ulm","education","DE","Germany",NA,NA,NA,NA,"author-profile","11/17/2025 14:33:17","JB","10.1111/jopy.12785","No, there is no statement that a pilot study was conducted","Keyword(s) in the references (e.g. ""J. Wild, A. Hackmann, D.M. Clark. Rescripting early memories linked to negative images in social phobia: A pilot study."")","","","","","","","","","","","","","","","","","","","","","","","","","","","","","","","","","","","","","< 1 minute"
"10.1101/lm.053521.121",2022,"Learning & Memory","1072-0502",0.926,NA,"United States","United States","United States","Memory and Neural Mechanisms","https://openalex.org/T10448",NA,NA,NA,"National Institute of Mental Health","10.13039/100000025","R01MH097964 || R01MH097880 || R01MH109638 || 1R01AT006344-01",NA,"<jats:p>Findings pertaining to sex differences in the acquisition and extinction of threat conditioning, a paradigm widely used to study emotional homeostasis, remain inconsistent, particularly in humans. This inconsistency is likely due to multiple factors, one of which is sample size. Here, we pooled functional magnetic resonance imaging (fMRI) and skin conductance response (SCR) data from multiple studies in healthy humans to examine sex differences during threat conditioning, extinction learning, and extinction memory recall. We observed increased functional activation in males, relative to females, in multiple parietal and frontal (medial and lateral) cortical regions during acquisition of threat conditioning and extinction learning. Females mainly exhibited higher amygdala activation during extinction memory recall to the extinguished conditioned stimulus and also while responding to the unconditioned stimulus (presentation of the shock) during threat conditioning. Whole-brain functional connectivity analyses revealed that females showed increased connectivity across multiple networks including visual, ventral attention, and somatomotor networks during late extinction learning. At the psychophysiological level, a sex difference was only observed during shock delivery, with males exhibiting higher unconditioned responses relative to females. Our findings point to minimal to no sex differences in the expression of conditioned responses during acquisition and extinction of such responses. Functional MRI findings, however, show some distinct functional activations and connectivities between the sexes. These data suggest that males and females might use different neural mechanisms, mainly related to cognitive processing, to achieve comparable levels of acquired conditioned responses to threating cues.</jats:p>",list(id = "https://openalex.org/T10448", display_name = "Memory and Neural Mechanisms", score = 0.999599993228912, subfield = list(id = "https://openalex.org/subfields/2805", display_name = "Cognitive Neuroscience"), field = list(id = "https://openalex.org/fields/28", display_name = "Neuroscience"), domain = list(id = "https://openalex.org/domains/1", display_name = "Life Sciences")),"New York University, United States","The University of Texas Health Science Center, United States","The University of Texas Health Science Center, United States","https://openalex.org/I57206974","New York University","education","US","United States",NA,NA,NA,NA,"article","https://openalex.org/I4210159031","The University of Texas Health Science Center","education","US","United States",NA,NA,NA,NA,"author-profile","https://openalex.org/I4210159031","The University of Texas Health Science Center","education","US","United States",NA,NA,NA,NA,"author-profile","11/17/2025 14:34:24","JB","10.1101/lm.053521.121","No, there is no statement that a pilot study was conducted","Keyword(s) in the references (e.g. ""J. Wild, A. Hackmann, D.M. Clark. Rescripting early memories linked to negative images in social phobia: A pilot study."")","","","","","","","","","","","","","","","","","","","","","","","","","","","","","","","","","","","","","< 1 minute"
"10.1002/eat.23862",2022,"International Journal of Eating Disorders","0276-3478",1.468,8,"United States","United States","United States","Eating Disorders and Behaviors","https://openalex.org/T10263",NA,NA,NA,NA,NA,NA,NA,"<jats:title>Abstract</jats:title><jats:sec><jats:title>Objective</jats:title><jats:p>Momentary worsening (i.e., greater than one's average levels) of state body dissatisfaction (BD) has been implicated as a proximal risk factor for eating disorder (ED) behaviors in binge‐spectrum EDs. Yet, research exploring the prospective association between noneating activities in daily life (e.g., chores, self‐care/coping) and momentary state BD remains limited. Understanding the momentary link between engagement in noneating activities and state BD, and pathways through which engagement in said activities influences momentary state BD is critical to informing treatments. The current ecological momentary assessment (EMA) study examined whether (1) engagement in noneating activities at Time 1 prospectively predicted momentary state BD at Time 2 and (2) reward drawn from noneating activities at Time 1 mediates the prospective association between engagement in noneating activities at Time 1 and momentary state BD at Time 2.</jats:p></jats:sec><jats:sec><jats:title>Method</jats:title><jats:p>Sixty‐six adults with transdiagnostic binge eating completed an EMA protocol over 7–14 days. Participants received six EMA signals per day (total EMA observations = 4038). Multilevel modeling was used to examine the research questions.</jats:p></jats:sec><jats:sec><jats:title>Results</jats:title><jats:p>Engagement in an indoor hobby, outdoor recreation, socializing, and self‐care/coping strategies prospectively predicted momentary state BD improvements, while using TV/social media and cooking prospectively predicted momentary state BD worsening. Reward drawn from engagement in these noneating activities mediated the associations.</jats:p></jats:sec><jats:sec><jats:title>Discussion</jats:title><jats:p>If replicated, these findings suggest that increasing the frequency of certain noneating activities and enhancing their rewarding aspects to improve state BD and decrease ED behavior risk during treatment may be worthy of further exploration.</jats:p></jats:sec><jats:sec><jats:title>Public Significance</jats:title><jats:p>Momentary worsening of state body dissatisfaction (BD) is a risk factor for eating disorder behaviors in individuals with binge eating. This study found that engaging in certain noneating activities (e.g., socializing) prospectively predicted momentary improvements in state BD, while other noneating activities (e.g., cooking) predicted momentary worsening of state BD. Reward drawn from activities mediated these relations. To improve state BD, treatments should target the frequency of, and reward obtained from these noneating activities.</jats:p></jats:sec>",list(id = "https://openalex.org/T10263", display_name = "Eating Disorders and Behaviors", score = 1, subfield = list(id = "https://openalex.org/subfields/3203", display_name = "Clinical Psychology"), field = list(id = "https://openalex.org/fields/32", display_name = "Psychology"), domain = list(id = "https://openalex.org/domains/2", display_name = "Social Sciences")),"Drexel University, United States","Allied Services, United States","Nemours Children's Health System, United States","https://openalex.org/I72816309","Drexel University","education","US","United States",NA,NA,NA,NA,"article","https://openalex.org/I4210132416","Allied Services","healthcare","US","United States",NA,NA,NA,NA,"author-profile","https://openalex.org/I4210108049","Nemours Children's Health System","healthcare","US","United States",NA,NA,NA,NA,"author-profile","11/17/2025 14:35:29","JB","10.1002/eat.23862","No, there is no statement that a pilot study was conducted","Keyword(s) in the references (e.g. ""J. Wild, A. Hackmann, D.M. Clark. Rescripting early memories linked to negative images in social phobia: A pilot study."")","","","","","","","","","","","","","","","","","","","","","","","","","","","","","","","","","","","","","<1 minute"
"10.1016/j.dcn.2022.101172",2022,"Developmental Cognitive Neuroscience","1878-9293",1.792,5,"United States","United States","United States","Child and Adolescent Psychosocial and Emotional Development","https://openalex.org/T10182",NA,NA,NA,"National Science Foundation || National Institutes of Health || National Institute of Mental Health || University of California, Los Angeles || Norges Forskningsråd","10.13039/100000001 || 10.13039/100000002 || 10.13039/100000025 || 10.13039/100007185 || 10.13039/501100005416","DGE-1650604 || U01DA041022 || U01DA041025 || U01DA041028 || U01DA041048 || U01DA041089 || U01DA041093 || U01DA041106 || U01DA041117 || U01DA041120 || U01DA041134 || U01DA041148 || U01DA041156 || U01DA041174 || U01DA050987 || U01DA050988 || U01DA050989 || U01DA051016 || U01DA051018 || U01DA051037 || U01DA051038 || U01DA051039 || U24DA041123 || U24DA041147 || R25MH120869 || 288083",NA,NA,list(id = "https://openalex.org/T10182", display_name = "Child and Adolescent Psychosocial and Emotional Development", score = 0.998700022697449, subfield = list(id = "https://openalex.org/subfields/3203", display_name = "Clinical Psychology"), field = list(id = "https://openalex.org/fields/32", display_name = "Psychology"), domain = list(id = "https://openalex.org/domains/2", display_name = "Social Sciences")),"University of Oregon, United States","University of Oregon, United States","University of Washington, United States","https://openalex.org/I181233156","University of Oregon","education","US","United States",NA,NA,NA,NA,"article","https://openalex.org/I181233156","University of Oregon","education","US","United States",NA,NA,NA,NA,"author-profile","https://openalex.org/I201448701","University of Washington","education","US","United States",NA,NA,NA,NA,"author-profile","11/17/2025 14:36:56","JB","10.1016/j.dcn.2022.101172","No, there is no statement that a pilot study was conducted","Keyword(s) in the references (e.g. ""J. Wild, A. Hackmann, D.M. Clark. Rescripting early memories linked to negative images in social phobia: A pilot study."")","","","","","","","","","","","","","","","","","","","","","","","","","","","","","","","","","","","","","1 minute"
