"10.1037/met0000330",2022,"Psychological Methods","1082-989X",4.247,14,"United Kingdom","United States","United States","Psychometric Methodologies and Testing","https://openalex.org/T10467",NA,NA,NA,"Japan Society for the Promotion of Science || American Psychological Foundation || Jacobs Foundation || Leverhulme Trust || Alexander von Humboldt Foundation","10.13039/501100001691 || 10.13039/100001945 || 10.13039/501100003986 || 10.13039/501100000275 || 10.13039/100005156","16H06406 || RL-2016-030",NA,NA,list(id = "https://openalex.org/T10467", display_name = "Psychometric Methodologies and Testing", score = 0.990000009536743, subfield = list(id = "https://openalex.org/subfields/1803", display_name = "Management Science and Operations Research"), field = list(id = "https://openalex.org/fields/18", display_name = "Decision Sciences"), domain = list(id = "https://openalex.org/domains/2", display_name = "Social Sciences")),"University of Reading, United Kingdom","Institute of Education Sciences, United States","Institute of Education Sciences, United States","https://openalex.org/I71052956","University of Reading","education","GB","United Kingdom",NA,NA,NA,NA,"article","https://openalex.org/I1303391909","Institute of Education Sciences","education","US","United States",NA,NA,NA,NA,"author-profile","https://openalex.org/I1303391909","Institute of Education Sciences","education","US","United States",NA,NA,NA,NA,"author-profile","11/14/2025 11:12:40","HL","10.1037/met0000330","Yes, the article states that there was a pilot study","","No","No, there is no statement about preregistration","5","Empirical study(ies)","Experimental study, Simulation study","""We first simulated 500 datasets from a data generation model based on Equation (3) with cluster size n = 32 and L2 sample size J = 30, and regarded the simulated datasets as 500 separate pilot test datasets. We then applied mixed-effects modelling to each of the
(hypothetical) pilot datasets. Next, based on the obtained results, we estimated a power curve for L1, L2, and L12 effects respectively, once using the summary-statistics-based method and again using a simulation-based method (with the simr package in R, replication = 1,000; Satterthwaite approximation was used to define degrees of freedom for the mixed-effects model). For the summary-statistics-based power analysis, we only used the t value obtained from the mixed-effects modelling and L2 sample size J = 30 as input to obtain a power curve when cluster size n = 32. To obtain power estimates with different cluster sizes, the summary-statistics-based power analysis used further information specified in the previous section.""
""In sum, this simulation produced 500 (hypothetical pilot datasets) x 3 (effect in focus: L1,
L2, or L12) x 3 (conditions) = 4,500 hypothetical pilot datasets, which were analyzed both by the summary-statistics- and simulation-based (replication = 1,000) power analyses to compare the results. For each hypothetical pilot dataset, both methods produced nine power estimates with three different levels of L2 sample sizes (J = 20, 30, and 40) combined with three different cluster sizes (n = 22, 32, and 42). Therefore, the simulation method ran 4500 x 1000 x 3 x 3 = 40,500,000 models to obtain power estimates. The simulation was run on the Laboratory of Neuroimaging (LONI) Pipeline system provided by the University of Southern California Mark and Mary Stevens Neuroimaging and Informatics Institute (Rex, Ma, & Toga, 2003).""
""We generated 1,000 hypothetical pilot datasets and then applied summary-statistics- and simulation-based (replication = 1,000) power analyses, estimating the power of three different L2 sample sizes (J - 10, J, and J + 10, where J is the L2 sample size of the hypothetical data) combined with three different cluster sizes (n – 10, n, and n + 10, where n is the cluster size of the hypothetical data). This procedure resulted in 9,000 (1,000 x 3 x 3) pairs of power estimates for L1 effect from the two methods with varying parameter values. An additional 9,000 pairs of power estimates were obtained for L2 effect, and another 9,000 pairs of power estimates were obtained for L12 effect.""","“Pilot*” (study, experiment, test or similar; piloting; piloted)","Yes","3 pilot simulations and 2 empirical studies","Imagine that there is a published study or a pilot study that researchers conducted, and they want to determine a L2 sample size (e.g., number of participants in case of a multi-trial experimental study or a diary study) for their new study based on that information. They are interested in a level-1 fixed-effect (γ10) in Equation (1). With our proposed approach, the researchers simply need the t value (or p value) associated with this fixed effect (γ10)
and the L2 sample size J from the previous study to compute an approximate statistical power.","We first simulated 500 datasets from a data generation model based on Equation (3) with cluster size n = 32 and L2 sample size J = 30, and regarded the simulated datasets as 500 separate pilot test datasets. We then applied mixed-effects modelling to each of the
(hypothetical) pilot datasets. Next, based on the obtained results, we estimated a power curve for L1, L2, and L12 effects respectively, once using the summary-statistics-based method and again using a simulation-based method (with the simr package in R, replication = 1,000; Satterthwaite approximation was used to define degrees of freedom for the mixed-effects model). For the summary-statistics-based power analysis, we only used the t value obtained from the mixed-effects modelling and L2 sample size J = 30 as input to obtain a power curve when cluster size n = 32. To obtain power estimates with different cluster sizes, the summary-statistics-based power analysis used further information specified in the previous section.","We first simulated 500 datasets from a data generation model based on Equation (3) with cluster size n = 32 and L2 sample size J = 30, and regarded the simulated datasets as 500 separate pilot test datasets. ","No","Simulation","No","","No","No (GO TO NEXT SECTION)","","","No (GO TO NEXT SECTION)","","","No (GO TO NEXT SECTION)","","","Yes","""The results are summarized in Table 3. Overall, summary-statistics-based power analysis produced comparable results with the simulation-based power analysis. In the baseline condition, where cluster size and predictor variance are constant across clusters,
summary-statistics-based power analysis should show very similar power estimates with
simulation-based power analysis. In fact, we saw little discrepancy between the proposed and simulation-based methods in the average power and RMSEs (0.009 – 0.019). Given the general equivalence of the two approaches, the observed discrepancy is likely due to sampling errors in the simulation method. In fact, with 1,000 replications of the simulation-based power analysis, the standard error of a proportion estimate is maximally 0.016 (when true proportion is 0.50).
Critically, the results were robust even under conditions where predictor variance or cluster
size was varied across clusters. On average, both methods showed very similar power estimates, indicating that the proposed method is not biased in a systematic manner. RMSEs are mostly below 0.025, although the discrepancy was slightly larger when both L2 sample size cluster sizes were small and cluster size was varied (maximum = 0.030). In comparison to the baseline condition, RMSEs became larger only by 0 – 0.012. The robustness of the summary-statistics-based power analysis is consistent with the previous observations that cluster size heterogeneity does not have much impact on the statistical power estimates (e.g., van Breukelen et al., 2007).""
""The regression results are summarized in Table 4. To quantify the stability of parameter estimates, we also showed 95% CI (we corrected for the standard errors to take into account the fact that the same hypothetical data produced 9 pairs of power estimates). In
short, the results confirmed the robustness of the summary-statistics-based power analysis for both conditions. For L1 effect, overall discrepancy was very small (for relative power difference, -0.0002 and -0.0009; for absolute power difference, 0.0095 and 0.0098). For both relative difference and absolute difference, none of the predictors had strong effects on the discrepancy. For example, L1 effect size showed a negative effect of -0.0039 on the absolute difference in power in the variant cluster size condition. This means that the absolute power difference between the two power analysis methods increased by 0.00039 when (standardized) L1 effect size is smaller by 0.1.
For L2 effect, overall discrepancy was very small (for relative difference, -0.0008 and -
0.0013; for absolute difference, 0.0117 and 0.0124). None of the predictors had strong effects, although the effects seem to be slightly larger than the L1 effect overall. For example, random intercept SD had a positive effect of β = 0.0125 on relative power difference in the varied cluster variance condition. This means that summary-statistics-based power analysis tended to overestimate the statistical power by 0.00125 when random intercept SD increased by 0.1 (i.e. as large as the SD of errors).
For L12 effect, again, overall discrepancy was very small (for relative power difference,
0.0004 and -0.0004; for absolute power difference, 0.0119 and 0.0146). Most of the predictors did not have strong effects. The biggest effect seems to be that of the standardized L12 effect on relative power difference, which showed β= -0.0543 in the varied cluster size condition. This suggests that summary-statistics-based power analysis tends to underestimate power by 0.00543 in comparison to the simulation-based method when standardized L12 effect size increases by 0.1.""
""Results are reported in Table 5. Overall, despite the adverse condition, the proposed method showed reasonably good performance across different combinations of L2 sample size and cluster size, generally indicating the robustness of the summary-statistics-based power analysis. Of particular interest was the case when L2 sample size was small (i.e. 10). Our two major observations were as follows. First, on average, the proposed
method showed very similar statistical power to the simulation-based power analysis. Second, when L2 sample size was small, RMSE increased up to 0.034 (for L1 effect) to 0.048 (for L12 effect); This was a ~0.02-0.03 increase from the baseline model in Simulation 1. Together, these results demonstrate the robustness of the summary-statistics-based power analysis, even with strong violations of the assumption of equal cluster size, and with the modest violation of the assumption of equal predictor variance. The results also suggest that, when dealing with small sample size data, researchers need to bear in mind the possibility that a power estimate based on the proposed method may not be very accurate (i.e. it is better to oversample to be on a safe side).
In sum, these simulation studies demonstrate the reasonable robustness of the summary-
statistics-based power analysis even when critical statistical assumptions are violated. The
discrepancy between the proposed and simulation-based methods do not seem to be strongly impacted by the nature of the prior data (i.e., true parameters that define hypothetical pilot data). Even under the conditions of unequal within-cluster variance of predictor and cluster size (up to CsV = 0.55-0.56), power estimates by the proposed method did not systematically differ from those by the simulation-based method on average, although RMSE became slightly higher when sample size was small.""","No, there is no statement about combining pilot data or results with the main study sample.",NA,"","This research was supported by JSPS KAKENHI (Grant Numbers 18H01102; 18K18696 to KM), F. J. McGuigan Early Career Investigator Prize from American Psychological Foundation (to KM); Jacobs Foundation Advanced Research Fellowship (to KM), the Leverhulme Trust Research Leadership Award (Grant Number RL-2016-030, to
KM), and the Alexander von Humboldt Foundation (the Alexander von Humboldt Professorship endowed by the German Federal Ministry of Education and Research; to K. M.). ","No, there is no conflict of interest statement","","It is an example which is not very generalizable","","28 minutes"
"10.1177/13623613221085339",2022,"Autism","1362-3613",1.767,1,NA,"United States","United States","Autism Spectrum Disorder Research","https://openalex.org/T10106",NA,NA,NA,"John and Marcia Goldman Foundation || HRSA","10.13039/100014161 || 10.13039/100000102","3104 || UA3 MC11055",NA,"<jats:p> Schools are the portal through which many children with autism spectrum disorder access early intervention. Collaborating with teachers can be an effective way to implement evidence-based practices. In this study, teachers learned to embed strategies from the Joint Attention, Symbolic Play, Engagement, and Regulation intervention into the standard preschool curriculum. Twelve schools with special education preschool classrooms for students with moderate to severe disabilities from under-resourced neighborhoods were randomized to augment their curriculum with Joint Attention, Symbolic Play, Engagement, and Regulation strategies or continue the standard curriculum. Teachers’ strategy implementation, children’s time on task, and social communication were examined before and after completing the intervention phase. Teachers in the Joint Attention, Symbolic Play, Engagement, and Regulation group implemented more Joint Attention, Symbolic Play, Engagement, and Regulation strategies than the control group after the intervention phase. Children in both groups increased time on task during teacher-led small group instruction. Children in the Joint Attention, Symbolic Play, Engagement, and Regulation group were more likely to be engaged with peers during small group instruction at the end of the intervention phase. Children from both groups improved in standardized measures of joint attention, requesting, expressive language, and receptive language. Training teachers to embed Joint Attention, Symbolic Play, Engagement, and Regulation strategies into small group instruction can help facilitate peer engagement, providing children more opportunities for peer socialization. </jats:p><jats:sec><jats:title>Lay abstract</jats:title><jats:p> Children with autism spectrum disorder attending special education preschool classrooms may not receive support that addresses their core challenges, such as engagement and social communication. There are interventions designed to target these core challenges, like the play-based intervention known as Joint Attention, Symbolic Play, Engagement, and Regulation. Embedding strategies from an intervention like Joint Attention, Symbolic Play, Engagement, and Regulation into more traditional academic activities can help teachers target engagement and social communication throughout the school day. In the current study, we collaborated with special education preschool teachers to embed Joint Attention, Symbolic Play, Engagement, and Regulation strategies during small group time for moderate to severe disability students with autism spectrum disorder, 3–5 years of age. Compared to teachers implementing the standard preschool curriculum, teachers trained in Joint Attention, Symbolic Play, Engagement, and Regulation strategies effectively embedded these strategies in their small group activities, and their students were more likely to engage with peers during these activities. Supporting teachers to embed targeted strategies in academic activities can help them provide students more opportunities to engage with peers during the school day. Teachers can support their autistic students to interact appropriately with their peers. Unlike interventions that train peers to act as a teacher, embedding Joint Attention, Symbolic Play, Engagement, and Regulation strategies during small group academic activities facilitates naturalistic social interactions for autistic students. </jats:p></jats:sec>",list(id = "https://openalex.org/T10106", display_name = "Autism Spectrum Disorder Research", score = 1, subfield = list(id = "https://openalex.org/subfields/2805", display_name = "Cognitive Neuroscience"), field = list(id = "https://openalex.org/fields/28", display_name = "Neuroscience"), domain = list(id = "https://openalex.org/domains/1", display_name = "Life Sciences")),NA,"University of California, Los Angeles, United States","University of California, Los Angeles, United States",NA,NA,NA,NA,NA,NA,NA,NA,NA,NA,"https://openalex.org/I161318765","University of California, Los Angeles","education","US","United States",NA,NA,NA,NA,"author-profile","https://openalex.org/I161318765","University of California, Los Angeles","education","US","United States",NA,NA,NA,NA,"author-profile","11/14/2025 11:19:53","HL","10.1177/13623613221085339","The article itself is a pilot randomized trial","The study is a pilot randomized trial","","","","","","","","","","","","","","","","","","","","","","","","","","","","","","","","","","","","","1 minute 35 seconds"
"10.1037/pspa0000297",2022,"Journal of Personality and Social Psychology","0022-3514",3.799,20,"Canada","Canada","Canada","Social and Intergroup Psychology","https://openalex.org/T10314",NA,NA,NA,"University of Chicago","10.13039/100007234",NA,NA,NA,list(id = "https://openalex.org/T10314", display_name = "Social and Intergroup Psychology", score = 0.886900007724762, subfield = list(id = "https://openalex.org/subfields/3312", display_name = "Sociology and Political Science"), field = list(id = "https://openalex.org/fields/33", display_name = "Social Sciences"), domain = list(id = "https://openalex.org/domains/2", display_name = "Social Sciences")),"Kellogg's (Canada), Canada","Kellogg's (Canada), Canada","Booth University College, Canada","https://openalex.org/I2801857525","Kellogg's (Canada)","company","CA","Canada",NA,NA,NA,NA,"article","https://openalex.org/I2801857525","Kellogg's (Canada)","company","CA","Canada",NA,NA,NA,NA,"author-profile","https://openalex.org/I325960478","Booth University College","education","CA","Canada",NA,NA,NA,NA,"author-profile","11/14/2025 11:26:58","HL","10.1037/pspa0000297","Yes, the article states that there was a pilot study","","No","Yes, the article states that there is a preregistration","6","Empirical study(ies)","Experimental study","Based on preliminary pilots, we anticipated that we would find medium to large effects.","“Pilot*” (study, experiment, test or similar; piloting; piloted)","No","",NA,NA,NA,"",NA,NA,"",NA,"No (GO TO NEXT SECTION)","","","No (GO TO NEXT SECTION)","","","No (GO TO NEXT SECTION)","","","Yes","Based on preliminary pilots, we anticipated that we would find medium to large effects.","No, there is no statement about combining pilot data or results with the main study sample.",NA,""," This work was supported by funding from the University of Chicago, Booth School of Business. ","No, there is no conflict of interest statement","","No","","5 minutes 48 seconds"
"10.1177/09567976221097615",2022,"Psychological Science","0956-7976",2.854,13,"United States","China","United States","Psychology of Social Influence","https://openalex.org/T13841",NA,NA,NA,"neubauer family foundation || booth school of business, university of chicago","10.13039/100019099 || 10.13039/100007618",NA,NA,"<jats:p> Performing acts of kindness increases well-being, yet people can be reluctant to ask for help that would enable others’ kindness. We suggest that people may be overly reluctant because of miscalibrated expectations about others’ prosocial motivation, underestimating how positively others will feel when asked for help. A pretest identified that interest in asking for help was correlated with expectations of how helpers would think and feel, but a series of scenarios, recalled experiences, and live interactions among adult participants in the United States (total N = 2,118) indicated that those needing help consistently underestimated others’ willingness to help, underestimated how positively helpers would feel, and overestimated how inconvenienced helpers would feel. These miscalibrated expectations stemmed from underestimating helpers’ prosocial motivation while overestimating compliance motivation. This research highlights a limitation of construing help-seeking through a lens of compliance by scholars and laypeople alike. Undervaluing prosociality could create a misplaced barrier to asking for help when needed. </jats:p>",list(id = "https://openalex.org/T13841", display_name = "Psychology of Social Influence", score = 0.998499989509583, subfield = list(id = "https://openalex.org/subfields/3312", display_name = "Sociology and Political Science"), field = list(id = "https://openalex.org/fields/33", display_name = "Social Sciences"), domain = list(id = "https://openalex.org/domains/2", display_name = "Social Sciences")),"Stanford University, United States","Chinese Academy of Sciences, China","University of Chicago, United States","https://openalex.org/I97018004","Stanford University","education","US","United States",NA,NA,NA,NA,"article","https://openalex.org/I19820366","Chinese Academy of Sciences","funder","CN","China",NA,NA,NA,NA,"author-profile","https://openalex.org/I40347166","University of Chicago","education","US","United States",NA,NA,NA,NA,"author-profile","11/14/2025 11:38:06","HL","10.1177/09567976221097615","Yes, the article states that there was a pilot study","","No","Yes, the article states that there is a preregistration","5","Empirical study(ies)","Experimental study","To test the latter presumption, we conducted a pilot test (N = 75; see the Supplemental Material available at https://osf.io/j67c3/) in which participants imagined needing immediate help across six scenarios used in Experiment 1a. This pilot test indicated that people’s reported willingness to ask for help was positively correlated with the potential helper’s presumed willingness to help them, β = 0.67, and with how positive they expected the helper would feel after fulfilling their request, β = 0.33, but was negatively related to how inconvenienced and annoyed they expected the helper to feel, β = −0.42, ps < .001. These results suggest that people asking for help not only care about achieving agreement but also care about how positive the helper feels about helping. If people underestimate the extent to which helpers are prosocially motivated, and hence would feel positive after helping, then people could be overly reluctant to request help when needed.","“Pilot*” (study, experiment, test or similar; piloting; piloted)","Yes","One pilot study reported in the article (single study)","We believe that these hypotheses are important because they clarify theoretical mechanisms underlying prosocial behavior and also because expectations about helpers’ experiences are likely to guide decisions to request help. To test the latter presumption, we conducted a pilot test (N = 75; see the Supplemental Material available at https://osf.io/j67c3/) in which participants imagined needing immediate help across six scenarios used in Experiment 1a.",NA,"To test the latter presumption, we conducted a pilot test (N = 75; see the Supplemental Material available at https://osf.io/j67c3/) in which participants imagined needing immediate help across six scenarios used in Experiment 1a. ",NA,NA,NA,"",NA,"Yes","An online, third-party repository (e.g. OSF, GitHub, FigShare, etc.)","Yes","No (GO TO NEXT SECTION)","","","Yes","An online, third-party repository (e.g. OSF, GitHub, FigShare, etc.)","Yes","Yes","This pilot test indicated that people’s reported willingness to ask for help was positively correlated with the potential helper’s presumed willingness to help them, β = 0.67, and with how positive they expected the helper would feel after fulfilling their request, β = 0.33, but was negatively related to how inconvenienced and annoyed they expected the helper to feel, β = −0.42, ps < .001.","No, there is no statement about combining pilot data or results with the main study sample.",NA,"","This research was funded by the Neubauer Family Faculty Fellowship and the University of Chicago Booth School of Business.","Yes, the statement says that there is no conflict of interest","","Yes","","9 minutes 40 seconds"
