"10.1177/09567976211032657",2022,"Psychological Science","0956-7976",2.854,13,"United States","United States","France","Decision-Making and Behavioral Economics","https://openalex.org/T10315",NA,NA,NA,NA,NA,NA,NA,"<jats:p> Past research has established that observing the outcomes of forgone alternatives is an important driver of regret. In this research, we predicted and empirically corroborated a seemingly opposite result: Participants in our studies were more likely to experience regret when they did not observe a forgone outcome than when it was revealed. Our prediction drew on two theoretical observations. First, feelings of regret frequently stem from comparing a chosen option with one’s belief about what the forgone alternative would have been. Second, when there are many alternatives to choose from under uncertainty, the perceived attractiveness of the almost-chosen alternative tends to exceed its reality. In four preregistered studies ( Ns = 800, 599, 150, and 197 adults), we found that participants predictably overestimated the forgone path, and this overestimation caused undue regret. We discuss the psychological implications of this hidden source of regret and reconcile the ostensible contradiction with past research. </jats:p>",list(id = "https://openalex.org/T10315", display_name = "Decision-Making and Behavioral Economics", score = 0.998499989509583, subfield = list(id = "https://openalex.org/subfields/1800", display_name = "General Decision Sciences"), field = list(id = "https://openalex.org/fields/18", display_name = "Decision Sciences"), domain = list(id = "https://openalex.org/domains/2", display_name = "Social Sciences")),"Dartmouth College, United States","Dartmouth College, United States","Institut d'Economie Scientifique Et de Gestion, France","https://openalex.org/I107672454","Dartmouth College","education","US","United States",NA,NA,NA,NA,"article","https://openalex.org/I107672454","Dartmouth College","education","US","United States",NA,NA,NA,NA,"author-profile","https://openalex.org/I4210148300","Institut d'Economie Scientifique Et de Gestion","education","FR","France",NA,NA,NA,NA,"author-profile","11/4/2025 11:41:42","AHS","10.1177/09567976211032657","They write in a footnote: 'Sample sizes for all of our studies reflect ... that usually drew on our previous studies, pilot studies, and..."" It is unclear whether for this article a pilot was conducted. It is not mentioned in the main text.","I think a previous pilot study, but that is unclear from the text.","","","","","","","","","","","","","","","","","","","","","","","","","","","","","","","","","","","","Small detail: Coder initials could be alphabetical to help search for ourselves","05:09 (min:sec)"
"10.1080/15374416.2022.2111684",2022,"Journal of Clinical Child & Adolescent Psychology","1537-4416",1.811,2,NA,"United States","United States","Child and Adolescent Psychosocial and Emotional Development","https://openalex.org/T10182",NA,NA,NA,"Fulbright U.S. Scholars Program || Institute of Education Sciences","10.13039/100005246","R324A180032",NA,NA,list(id = "https://openalex.org/T10182", display_name = "Child and Adolescent Psychosocial and Emotional Development", score = 0.998499989509583, subfield = list(id = "https://openalex.org/subfields/3203", display_name = "Clinical Psychology"), field = list(id = "https://openalex.org/fields/32", display_name = "Psychology"), domain = list(id = "https://openalex.org/domains/2", display_name = "Social Sciences")),NA,"University of Maryland, College Park, United States","Harvard University, United States",NA,NA,NA,NA,NA,NA,NA,NA,NA,NA,"https://openalex.org/I66946132","University of Maryland, College Park","education","US","United States",NA,NA,NA,NA,"author-profile","https://openalex.org/I136199984","Harvard University","education","US","United States",NA,NA,NA,NA,"author-profile","11/4/2025 12:10:53","AHS","10.1080/15374416.2022.2111684","No, there is no statement that a pilot study was conducted","Keyword(s) in the references (e.g. ""J. Wild, A. Hackmann, D.M. Clark. Rescripting early memories linked to negative images in social phobia: A pilot study."")","","","","","","","","","","","","","","","","","","","","","","","","","","","","","","","","","","","","","01:02"
"10.1037/xge0001195",2022,"Journal of Experimental Psychology General","0096-3445",2.023,16,NA,"United States","United States","Language, Metaphor, and Cognition","https://openalex.org/T11148",NA,NA,NA,"National Science Foundation",NA,"1022684",NA,NA,list(id = "https://openalex.org/T11148", display_name = "Language, Metaphor, and Cognition", score = 0.920000016689301, subfield = list(id = "https://openalex.org/subfields/3205", display_name = "Experimental and Cognitive Psychology"), field = list(id = "https://openalex.org/fields/32", display_name = "Psychology"), domain = list(id = "https://openalex.org/domains/2", display_name = "Social Sciences")),NA,"Yale University, United States","Institute of Cognitive and Brain Sciences, United States",NA,NA,NA,NA,NA,NA,NA,NA,NA,NA,"https://openalex.org/I32971472","Yale University","education","US","United States",NA,NA,NA,NA,"author-profile","https://openalex.org/I4210104429","Institute of Cognitive and Brain Sciences","education","US","United States",NA,NA,NA,NA,"author-profile","11/4/2025 12:32:01","AHS","10.1037/xge0001195","Yes, the article states that there was a pilot study","","No","There is a statement that the study was not preregistered","7","Empirical study(ies)","Experimental study","After a day of piloting, we noticed major differences from documented behavior of US children in a simple picture-based generalization task.","“Pilot*” (study, experiment, test or similar; piloting; piloted)","No","","Unsure about what paradigms were best suited for cross-cultural developmental work, we began by testing common paradigms, including a simple generalization task from an exemplar.",NA,NA,NA,NA,NA,"",NA,"No (GO TO NEXT SECTION)","","","No (GO TO NEXT SECTION)","","","No (GO TO NEXT SECTION)","","","No","","No, there is no statement about combining pilot data or results with the main study sample.","we realized that a generalization by shape indeed didn‟t seem reasonable for many of the objects in our immediate surrounding, which led to the hypothesis and experiments presented here.","I have the feeling the pilot was more a method trial than a formal test of the materials.","This work was supported by NSF Grant 1022684 from the REESE program to Edward Gibson.","No, there is no conflict of interest statement","","No","I encountered a specific statement that the study was not preregistered by could not indicate this in the form. Maybe add as option: Yes, indication that the study has not been preregistered","13:06"
"10.1111/desc.13223",2021,"Developmental Science","1363-755X",2.174,5,"France","France","Hungary","Child and Animal Learning Development","https://openalex.org/T10656",NA,NA,NA,"European Commission","10.13039/501100000780","REPCOLLAB || ERC‐2011‐StG_20101124",NA,"<jats:title>Abstract</jats:title>
                  <jats:p>
                    How do people learn about things that they have never perceived or inferred–like molecules, miracles or Marie‐Antoinette? For many thinkers, trust is the answer. Humans rely on communicated information, sometimes even when it contradicts blatantly their firsthand experience. We investigate the early ontogeny of this trust using a non‐verbal search paradigm in four main studies and three supplementary studies (
                    <jats:italic>N</jats:italic>
                     = 208). Infants and toddlers first see where a reward is, and then an informant communicates to them that it is in another location. We use this general experimental set‐up to assess the role of age, informants’ knowledge, cue's familiarity, and communicative context on trust in communicated information. Results reveal that infants and toddlers quickly trust familiar and novel communicative cues from well‐informed adults. When searching for the reward, they follow a well‐informed adults’ communicative cue, even when it contradicts what they just saw. Furthermore, infants are less likely to be guided by familiar and novel cues from poorly informed adults than toddlers. Thus, reliance on communication is calibrated during early childhood, up to the point of overriding evidence about informants’ knowledge. Moreover, toddlers trust much more strongly a novel cue when it is used in a communicative manner. Toddlers’ trust cannot be explained by mere compliance: it is highly reduced when communicated information is pitted against what participants currently see. Thus, humans’ strong tendency to rely on familiar and novel communicative cues emerges in infancy, and intensifies during the second year of life.
                  </jats:p>",list(id = "https://openalex.org/T10656", display_name = "Child and Animal Learning Development", score = 0.999800026416779, subfield = list(id = "https://openalex.org/subfields/3204", display_name = "Developmental and Educational Psychology"), field = list(id = "https://openalex.org/fields/32", display_name = "Psychology"), domain = list(id = "https://openalex.org/domains/2", display_name = "Social Sciences")),"Université Paris Cité, France","Université Paris Cité, France","Eötvös Loránd University, Hungary","https://openalex.org/I204730241","Université Paris Cité","education","FR","France",NA,NA,NA,NA,"article","https://openalex.org/I204730241","Université Paris Cité","education","FR","France",NA,NA,NA,NA,"author-profile","https://openalex.org/I106118109","Eötvös Loránd University","education","HU","Hungary",NA,NA,NA,NA,"author-profile","11/4/2025 12:58:39","AHS","10.1111/desc.13223","Yes, the article states that there was a pilot study","","No","No, there is no statement about preregistration","4","Empirical study(ies)","Experimental study","A pilot study revealed that...","“Pilot*” (study, experiment, test or similar; piloting; piloted)","Maybe, 'a pilot' suggests one pilot study","",NA,"Uncertain. This was reported on the study for which the pilot was conducted: We evaluate these hypotheses in Study 3, by investigating the calibration of children’s reliance on a novel cue–placing a marker on top of a bucket",NA,"",NA,NA,"",NA,"Uncertain: general avaibility statement for whole paper (Additional data related to this paper may be requested from the authors.)","Upon request from the authors","No","No (GO TO NEXT SECTION)","","","No (GO TO NEXT SECTION)","","","No","","No, there is no statement about combining pilot data or results with the main study sample.","As a result, in Study 3 we tested 18-month-olds and 24-month-olds.","","European Commission, Grant/Award Numbers: REPCOLLAB, ERC-2011-StG_20101124; Agence Nationale pour la Recherche, Grant/Award Numbers: FoundTrust, ANR21-CE28-0017-01","Yes, the statement says that there is no conflict of interest","","No","","12:08"
"10.1037/xhp0001017",2022,"Journal of Experimental Psychology Human Perception & Performance","0096-1523",1.108,14,"United Kingdom","United Kingdom","United States","Action Observation and Synchronization","https://openalex.org/T11431",NA,NA,NA,"Leverhulme Trust","10.13039/501100000275","RPG-2019-010",NA,NA,list(id = "https://openalex.org/T11431", display_name = "Action Observation and Synchronization", score = 0.972199976444244, subfield = list(id = "https://openalex.org/subfields/3207", display_name = "Social Psychology"), field = list(id = "https://openalex.org/fields/32", display_name = "Psychology"), domain = list(id = "https://openalex.org/domains/2", display_name = "Social Sciences")),"Durham University, United Kingdom","Durham University, United Kingdom","The King's College, United States","https://openalex.org/I190082696","Durham University","education","GB","United Kingdom",NA,NA,NA,NA,"article","https://openalex.org/I190082696","Durham University","education","GB","United Kingdom",NA,NA,NA,NA,"author-profile","https://openalex.org/I144852770","The King's College","education","US","United States",NA,NA,NA,NA,"author-profile","11/4/2025 13:58:48","AHS","10.1037/xhp0001017","Yes, the article states that there was a pilot study","","No","Yes, the article states that there is a preregistration","2","Empirical study(ies)","Experimental study","Based on data from 11 pilot participants we estimated an interaction effect...","“Pilot*” (study, experiment, test or similar; piloting; piloted)","No","","Not explicitly mentioned, but for power calculations",NA,"11 pilot participants",NA,NA,NA,"",NA,"It says data are shared on OSF, but not specific to pilot data","An online, third-party repository (e.g. OSF, GitHub, FigShare, etc.)","No","Unclear if pilot materials or study materials are shared","An online, third-party repository (e.g. OSF, GitHub, FigShare, etc.)","No","Unclear if study materials and pilot materials are shared","An online, third-party repository (e.g. OSF, GitHub, FigShare, etc.)","No","Yes","we estimated an interaction effect size of 31.8ms for stimulus contrast and social identity for a generalized linear mixed effects model of reaction time data","No, there is no statement about combining pilot data or results with the main study sample.",NA,"","This work was supported by the Leverhulme Trust (RPG-2019-010)","No, there is no conflict of interest statement","","No","","11:03"
"10.1002/eat.23690",2022,"International Journal of Eating Disorders","0276-3478",1.468,8,"United States","United States","United States","Eating Disorders and Behaviors","https://openalex.org/T10263",NA,NA,NA,"Argosy Foundation","10.13039/100000976",NA,NA,"<jats:title>Abstract</jats:title><jats:sec><jats:title>Objective</jats:title><jats:p>Apps purporting to assist with the management of eating disorders are proliferating; although less is known about (a) the safety or efficacy of the apps on the marketplaces and (b) if the research evidence supports dissemination of these apps. In this research forum, we seek to synthesize the current data and provide practical considerations around the use and research of these apps.</jats:p></jats:sec><jats:sec><jats:title>Methods</jats:title><jats:p>A search of the iOS and Google Play stores was conducted in June 2021 to identify publicly available apps targeting eating disorders. A PubMed search was also conducted in June 2021 to identify relevant publications around smartphone apps for eating disorders.</jats:p></jats:sec><jats:sec><jats:title>Results</jats:title><jats:p>Sixty‐five apps that support the treatment of eating disorders were identified and coded across 105 data points on the publicly available <jats:ext-link xmlns:xlink=""http://www.w3.org/1999/xlink"" xlink:href=""http://mindapps.org"">mindApps.org</jats:ext-link> website. The literature search revealed 13 articles. Seven percent of marketplaces apps offered any research support and the 13 published studies focused on only four apps.</jats:p></jats:sec><jats:sec><jats:title>Discussion</jats:title><jats:p>There is a need for more translational research on smartphone apps for eating disorders. Current marketplace offerings present risks that may not be balanced by their limited evidence. Research efforts should focus on offering evidenced‐based apps for the marketplace. Clinicians should weigh known and emerging risks and benefits of these apps within the context of research gaps when making decisions around use.</jats:p></jats:sec>",list(id = "https://openalex.org/T10263", display_name = "Eating Disorders and Behaviors", score = 0.999199986457825, subfield = list(id = "https://openalex.org/subfields/3203", display_name = "Clinical Psychology"), field = list(id = "https://openalex.org/fields/32", display_name = "Psychology"), domain = list(id = "https://openalex.org/domains/2", display_name = "Social Sciences")),"Tufts University, United States","Tufts University, United States","Beth Israel Deaconess Medical Center, United States","https://openalex.org/I121934306","Tufts University","education","US","United States",NA,NA,NA,NA,"article","https://openalex.org/I121934306","Tufts University","education","US","United States",NA,NA,NA,NA,"author-profile","https://openalex.org/I1316535847","Beth Israel Deaconess Medical Center","healthcare","US","United States",NA,NA,NA,NA,"author-profile","11/4/2025 22:49:04","IHM","10.1002/eat.23690","No, there is no statement that a pilot study was conducted","Refering to previous studies (e.g. ""a small pilot study yielded similar findings in children with ASD (Chong et al., 2021).""","","","","","","","","","","","","","","","","","","","","","","","","","","","","","","","","","","","","","5 mins (to determine that it wasn't actually reporting pilot studies)"
"10.3758/s13415-022-01031-x",2022,"Cognitive Affective & Behavioral Neuroscience","1530-7026",1.085,5,"United States","United States","United States","Anxiety, Depression, Psychometrics, Treatment, Cognitive Processes","https://openalex.org/T10853",NA,NA,NA,NA,NA,NA,NA,NA,list(id = "https://openalex.org/T10853", display_name = "Anxiety, Depression, Psychometrics, Treatment, Cognitive Processes", score = 0.999800026416779, subfield = list(id = "https://openalex.org/subfields/3205", display_name = "Experimental and Cognitive Psychology"), field = list(id = "https://openalex.org/fields/32", display_name = "Psychology"), domain = list(id = "https://openalex.org/domains/2", display_name = "Social Sciences")),"VA Boston Healthcare System, United States","Boston University, United States","University of Miami, United States","https://openalex.org/I2801671727","VA Boston Healthcare System","healthcare","US","United States",NA,NA,NA,NA,"article","https://openalex.org/I111088046","Boston University","education","US","United States",NA,NA,NA,NA,"author-profile","https://openalex.org/I145608581","University of Miami","education","US","United States",NA,NA,NA,NA,"author-profile","11/4/2025 22:57:44","IHM","10.3758/s13415-022-01031-x","No, there is no statement that a pilot study was conducted","Refering to previous studies (e.g. ""a small pilot study yielded similar findings in children with ASD (Chong et al., 2021).""","","","","","","","","","","","","","","","","","","","","","","","","","","","","","","","","","","","","For section 1.3.1 (Additional information on keywords), it only allows you to select one option, but sometimes there could be multiple reasons that a keyword hit (for example, the paper referred to a previous study that was preliminary AND the study used the term pilot in a different context, such as ""auto-pilot"")","4 mins (to determine that this article didn't actually report a pilot)"
"10.1111/jopy.12754",2022,"Journal of Personality","0022-3506",2.192,20,"United States","United States","United States","Youth Development and Social Support","https://openalex.org/T11998",NA,NA,NA,NA,NA,NA,NA,"<jats:title>Abstract</jats:title><jats:sec><jats:title>Objective</jats:title><jats:p>This psychobiography analyzes the life of Khali Sweeney from Detroit's Downtown Boxing Gym to understand his motivation for and methods as a social change agent. In doing so, the project also considers how to prepare the next generation of youth development leaders as social change agents.</jats:p></jats:sec><jats:sec><jats:title>Method</jats:title><jats:p>We conducted a nine‐step psychobiography based on recommendations from established psychobiographical methods. Using a team‐based, thematic analysis approach we analyzed contextual, first‐, second‐, and third‐ person data from the perspective of Phenomenological Variant of Ecological Systems Theory (PVEST).</jats:p></jats:sec><jats:sec><jats:title>Results</jats:title><jats:p>Results suggest Khali is an effective social change agent due to five interrelated factors. Analyzing Khali's life through the lens of PVEST also revealed his experiences resulted in two realizations central to him becoming a social change agent: the people and services that are supposed to serve youth at times do not, and; individuals like him can step up to meet youth needs.</jats:p></jats:sec><jats:sec><jats:title>Conclusions</jats:title><jats:p>Results point to several important lessons related to transformational leadership theory that can enable YDP leaders to serve as social change agents.</jats:p></jats:sec>",list(id = "https://openalex.org/T11998", display_name = "Youth Development and Social Support", score = 0.999899983406067, subfield = list(id = "https://openalex.org/subfields/3311", display_name = "Safety Research"), field = list(id = "https://openalex.org/fields/33", display_name = "Social Sciences"), domain = list(id = "https://openalex.org/domains/2", display_name = "Social Sciences")),"Purdue University West Lafayette, United States","University of Iowa, United States","Purdue University West Lafayette, United States","https://openalex.org/I219193219","Purdue University West Lafayette","education","US","United States",NA,NA,NA,NA,"article","https://openalex.org/I126307644","University of Iowa","education","US","United States",NA,NA,NA,NA,"author-profile","https://openalex.org/I219193219","Purdue University West Lafayette","education","US","United States",NA,NA,NA,NA,"author-profile","11/4/2025 23:01:46","IHM","10.1111/jopy.12754","No, there is no statement that a pilot study was conducted","This study was a ""psychobiography"" about a person who piloted several social programs (but the study itself did not run a pilot) ","","","","","","","","","","","","","","","","","","","","","","","","","","","","","","","","","","","","","3 mins (to determine that this study didn't conduct a pilot)"
"10.1093/jpepsy/jsac022",2022,"Journal of Pediatric Psychology","0146-8693",1.123,1,"United States","United States","United States","Family and Disability Support Research","https://openalex.org/T11632",NA,NA,NA,"Mentored Research Scholar Grant in Applied and Clinical Research || American Cancer Society, and by the American Lebanese Syrian Associated Charities",NA,"MRSG-16-054-01-PCSM",NA,"<jats:title>Abstract</jats:title>
               <jats:sec>
                  <jats:title>Objectives</jats:title>
                  <jats:p>Psychosocial late effects among survivors of pediatric brain tumors are common. For school-aged survivors, social skills deficits and isolation present a particular challenge. Social problem-solving is a social skill that is an important determinant of social outcomes and may yield a potential target for intervention.</jats:p>
               </jats:sec>
               <jats:sec>
                  <jats:title>Methods</jats:title>
                  <jats:p>School-aged youth (N = 65) 8–12 years of age (10.59 ± 1.36 years; 55.4% female, 86.2% white) who were 5.23 (SD = 2.44, range 2–10.9) years post-treatment for a brain tumor completed the Attributions and Coping Questionnaire, a measure of social problem-solving that uses vignettes to assess attribution of intent, subsequent emotional response, and imagined behavioral response to an interpersonal problem. Youth also completed self-reports of social functioning (PROMIS Peer Relationships, Self-Perception Profile). A caregiver completed additional measures of child social functioning (NIH Toolbox—Emotion Measures).</jats:p>
               </jats:sec>
               <jats:sec>
                  <jats:title>Results</jats:title>
                  <jats:p>Survivors attributed unpleasant situations to accidental causes (neutral attribution) and responded in ways that prioritized the friendship (appeasement) or relied on adult intervention. Self-reported social functioning was higher among those who were less likely to avoid challenging social problem-solving situations.</jats:p>
               </jats:sec>
               <jats:sec>
                  <jats:title>Conclusions</jats:title>
                  <jats:p>Findings identified characteristic social problem-solving approaches among survivors, including a tendency to attribute ambiguous situations to accidental causes and to request adult assistance and/or maintain social relationships. This may indicate a possible avenue for intervention, with a focus on increasing survivors’ understanding of the causes of potentially negative peer interactions and reducing their reliance on adults.</jats:p>
               </jats:sec>",list(id = "https://openalex.org/T11632", display_name = "Family and Disability Support Research", score = 0.993600010871887, subfield = list(id = "https://openalex.org/subfields/3203", display_name = "Clinical Psychology"), field = list(id = "https://openalex.org/fields/32", display_name = "Psychology"), domain = list(id = "https://openalex.org/domains/2", display_name = "Social Sciences")),"St. Jude Children's Research Hospital, United States","National Institutes of Health, United States","St. Jude Children's Research Hospital, United States","https://openalex.org/I1313298211","St. Jude Children's Research Hospital","healthcare","US","United States",NA,NA,NA,NA,"article","https://openalex.org/I1299303238","National Institutes of Health","government","US","United States",NA,NA,NA,NA,"author-profile","https://openalex.org/I1313298211","St. Jude Children's Research Hospital","healthcare","US","United States",NA,NA,NA,NA,"author-profile","11/4/2025 23:05:06","IHM","10.1093/jpepsy/jsac022","No, there is no statement that a pilot study was conducted","Keyword(s) in the references (e.g. ""J. Wild, A. Hackmann, D.M. Clark. Rescripting early memories linked to negative images in social phobia: A pilot study."")","","","","","","","","","","","","","","","","","","","","","","","","","","","","","","","","","","","","","2 mins (to determine that the study didn't run a pilot)"
