"doi","year","journal","issn","sjr","top_factor","article_location","first_author_location","last_author_location","primary_topic_display_name","primary_topic_id","funding_funders_openalex","funding_funder_ids_openalex","funding_award_ids_openalex","funding_funders_crossref","funding_funder_ids_crossref","funding_award_ids_crossref","coi_crossref","cr_abstract","primary_topic","article_location_label","first_author_location_label","last_author_location_label","article_location_detail_id","article_location_detail_display_name","article_location_detail_type","article_location_detail_country_code","article_location_detail_country","article_location_detail_city","article_location_detail_region","article_location_detail_latitude","article_location_detail_longitude","article_location_detail_source","first_author_location_detail_id","first_author_location_detail_display_name","first_author_location_detail_type","first_author_location_detail_country_code","first_author_location_detail_country","first_author_location_detail_city","first_author_location_detail_region","first_author_location_detail_latitude","first_author_location_detail_longitude","first_author_location_detail_source","last_author_location_detail_id","last_author_location_detail_display_name","last_author_location_detail_type","last_author_location_detail_country_code","last_author_location_detail_country","last_author_location_detail_city","last_author_location_detail_region","last_author_location_detail_latitude","last_author_location_detail_longitude","last_author_location_detail_source","Timestamp","X1.1..Coder.Initials","X1.2..Article.DOI","X1.3..Is.there.a.statement.in.the.article.that.there.was.a.pilot.study.conducted.","X1.3.1..If.there.is.no.pilot.study.reported.in.the.article..what.did.the.keyword..pilot....preliminary.study..or..feasibility.study..refer.to..","X2.1...Is.the.article.a.Registered.Report.","X2.2...Does.the.article.state.whether.or.not.reported.study.studies.were.preregistered.","X2.3..How.many.studies.does.the.article.report.","X2.4..What.type.of.study.ies..are.being.reported.","X2.4.1..If.the.article.reports.empirical.data..what.type.of.empirical.data.study.is.being.reported.","X3.1.How.does.the.article.state.that.there.was.a.pilot.study.conducted.","X3.2..How.is.the.pilot.study.referred.to.in.the.article.","X3.3..Does.the.article.state.how.many.pilots.have.been.conducted.","X3.3.1.If.there.is.a.statement.about.the.number.of.pilots.conducted..what.is.the.number.of.pilots.","X3.4..Does.the.article.state.the.purpose.of.the.pilot.s..that.have.been.conducted.","X3.5..Does.the.article.state.how.the.overall.procedure.for.the.pilot.s..was.decided.upon.","X3.6..Does.the.article.state.the.sample.size.s..of.the.pilot.s..that.have.been.conducted.","X3.6.1.If.the.article.state.the.pilot.s..sample.size.s...does.it.state.the.justification.of.the.sample.size.s...","X3.7.Does.the.article.state.the.recruitment.method.for.the.sample.in.the.pilot.studies.","X3.8.Does.the.article.state.the.stopping.rule..the.decision.behind.finalizing.piloting.","X3.8.1..If.the.article.states.the.stopping.rule..is.it.possible.to.categorize.this.rule.into.one.or.more.of.the.categories.below..","X3.9..Is.there.a.statement.on.how.similar.or.different.the.pilot.s..were.from.the.main.study.ies..","X4.1..Does.the.article.state.whether.or.not.data.from.the.pilot.s..are.available.","X4.1.1.If.pilot.data.are.available..how.does.the.statement.indicate.that.the.data.are.available.","X4.1.2.If.pilot.data.are.available..can.you.access..download..and.open.the.data.files.without.an.additional.step.such.as.a.sign.up.or.a.login..","X5.1..Does.the.article.state.whether.or.not.pilot.analysis.scripts.are.available.","X5.1.1.If.pilot.analyses.are.available..how.does.the.statement.indicate.that.they.are.available..","X5.1.2..If.pilot.analyses.are.available..can.you.access..download..and.open.the.pilot.analysis.scripts.without.an.additional.step.such.as.a.sign.up.or.a.login.","X6.1...Does.the.article.state.whether.or.not.pilot.materials.methods.are.available.","X6.1.1.If.pilot.materials.methods.are.available..how.does.the.statement.indicate.that.they.are.available..","X6.1.2..If.pilot.materials.methods.are.available..can.you.access..download..and.open.the.files.without.an.additional.step.such.as.a.sign.up.or.a.login..","X7.1...Does.the.article.report.results.or.outcomes.from.the.analysis.of.the.pilot.study.data.","X7.1.1..If.pilot.results.or.outcomes.are.reported..what.are.the.reported.results.","X7.1.2..Does.the.article.state.that.the.data.or.results.from.the.pilot.were.combined.with.the.final..main.study.results..","X7.1.3..Does.the.article.state.whether.or.how.the.pilot.study.results.affected.the.main.study.","Any.other.details","X8.1..Does.the.article.include.a.funding.statement.","X8.2..Does.the.article.include.a.statement.indicating.whether.there.were.any.conflicts.of.interest.","X8.2.1..If.there.is.a.conflict.of.interest.statement..what.is.the.statement.","Is.the.pilot.reporting.in.this.article.an.example.of..best.practice..that.could.be.used.to.guide.others.","X9.1..Do.you.have.any.feedback.on.the.form..instructions.or.general.coding.procedure.","X9.2..How.much.time.did.it.take.you.to.code.this.article."
"10.1016/j.brat.2022.104152",2022,"Behaviour Research and Therapy","0005-7967",1.787,2,NA,"United States","United States","Perfectionism, Procrastination, Anxiety Studies","https://openalex.org/T12258",NA,NA,NA,NA,NA,NA,NA,NA,list(id = "https://openalex.org/T12258", display_name = "Perfectionism, Procrastination, Anxiety Studies", score = 1, subfield = list(id = "https://openalex.org/subfields/3203", display_name = "Clinical Psychology"), field = list(id = "https://openalex.org/fields/32", display_name = "Psychology"), domain = list(id = "https://openalex.org/domains/2", display_name = "Social Sciences")),NA,"University of Louisville, United States","Utah State University, United States",NA,NA,NA,NA,NA,NA,NA,NA,NA,NA,"https://openalex.org/I142740786","University of Louisville","education","US","United States",NA,NA,NA,NA,"author-profile","https://openalex.org/I121980950","Utah State University","education","US","United States",NA,NA,NA,NA,"author-profile","10/24/2025 7:52:05","MME","https://doi.org/10.1016/j.brat.2022.104152","Yes, the article states that there was a pilot study","","No","Yes, the article states that there is a preregistration","1","Empirical study(ies)","Experimental study, Quantitative observational study, Randomized Controlled Trial (RCT)","The current study is a proof of concept and preliminary test of the feasibility and efficacy of treating two specific features of perfectionism with two online self-help trainings based on PBT principles: a four-session cognitive training and a four-session motivational training (order in which trainings were delivered was randomized). Given the exploratory nature of this investigation, we recruited a convenience sample of participants who self-reported elevated levels of perfectionism. Initial key tests of the premises of PBT include determining whether improving these processes improves outcomes (procedural utility) and whether distinct procedures have distinct functions in targeting relevant processes (procedural precision).","“Preliminary” (study, experiment, test or similar)","No","One pilot study reported in the article (single study)","The current study is a proof of concept and preliminary test of the feasibility and efficacy of treating two specific features of perfectionism with two online self-help trainings based on PBT principles: a four-session cognitive training and a four-session motivational training (order in which trainings were delivered was randomized). ","The current study is a proof of concept and preliminary test of the feasibility and efficacy of treating two specific features of perfectionism with two online self-help trainings based on PBT principles: a four-session cognitive training and a four-session motivational training (order in which trainings were delivered was randomized). Given the exploratory nature of this investigation, we recruited a convenience sample of participants who self-reported elevated levels of perfectionism. Initial key tests of the premises of PBT include determining whether improving these processes improves outcomes (procedural utility) and whether distinct procedures have distinct functions in targeting relevant processes (procedural precision).","Participants who met eligibility criteria (N = 77) were randomized into one of two groups using block randomization to ensure approximately equal numbers in each group. The first author generated the random allocation sequence with a random number table. Participants self-enrolled in the study; they were provided with a link to the informed consent document after completing the screener if they met eligibility criteria.","No","Given the exploratory nature of this investigation, we recruited a convenience sample of participants who self-reported elevated levels of perfectionism.",NA,"",NA,"No (GO TO NEXT SECTION)","","","No (GO TO NEXT SECTION)","","","No (GO TO NEXT SECTION)","","","Yes","Results from these models are described in the following paragraphs. Means and standard deviations of self-report measures over time are presented in Table 5.","They treat the article as a preliminary","N/A","They report most of the statistics and data in tables. ","This study was funded by a Research Development Grant from the Association for Contextual Behavioral Science.","Yes, the statement says that there are one or more conflicts of interest","The authors declare they have no conflicts of interest.","No","",""
"10.3758/s13428-021-01776-2",2022,"Behavior Research Methods","1554-351X",2.753,7,"Germany","Germany","Germany","Mental Health Research Topics","https://openalex.org/T13283",NA,NA,NA,"Universität Konstanz","10.13039/501100010583",NA,"Declarations || The author has disclosed the following potential conflicts of interest related to the research, authorship, and/or publication of this article: The author is the founder of Open Lab Online UG (haftungsbeschränkt), a company registered in Germany, which resulted from the development of the software presented herein. The revenue generated beyond the operating costs (e.g., server hosting, maintenance) is used for the further development of the software. || Conflicts of interest/Competing interests","<jats:title>Abstract</jats:title><jats:p>Online experiments have become a popular way of collecting data in the social and behavioral sciences. However, the high technical hurdles of setting up a server may prevent researchers from starting them. Also, proprietary software may restrict a researcher’s freedom to customize or share their study. Open Lab is a server-side application designed to host online surveys and experiments created using lab.js. Available online at <jats:ext-link xmlns:xlink=""http://www.w3.org/1999/xlink"" ext-link-type=""uri"" xlink:href=""https://open-lab.online"">https://open-lab.online</jats:ext-link>, Open Lab offers a fast, secure, and transparent way to deploy studies; it handles uploading experiment scripts, customizing study design, managing the participant database, and working with the study results. Open Lab is integrated with the lab.js experiment builder (<jats:ext-link xmlns:xlink=""http://www.w3.org/1999/xlink"" ext-link-type=""uri"" xlink:href=""https://lab.js.org/"">https://lab.js.org/</jats:ext-link>), a browser-based program which enables the creation of new studies from scratch or the use of templates. This paper compares Open Lab with other study deployment services, discusses how Open Lab contributes to open science practices, and provides a step-by-step guide for researchers.</jats:p>",list(id = "https://openalex.org/T13283", display_name = "Mental Health Research Topics", score = 0.988499999046326, subfield = list(id = "https://openalex.org/subfields/3205", display_name = "Experimental and Cognitive Psychology"), field = list(id = "https://openalex.org/fields/32", display_name = "Psychology"), domain = list(id = "https://openalex.org/domains/2", display_name = "Social Sciences")),"University of Konstanz, Germany","University of Konstanz, Germany","University of Konstanz, Germany","https://openalex.org/I189712700","University of Konstanz","education","DE","Germany",NA,NA,NA,NA,"article","https://openalex.org/I189712700","University of Konstanz","education","DE","Germany",NA,NA,NA,NA,"author-profile","https://openalex.org/I189712700","University of Konstanz","education","DE","Germany",NA,NA,NA,NA,"author-profile","10/24/2025 7:54:27","MME","https://doi.org/10.3758/s13428-021-01776-2","No, there is no statement that a pilot study was conducted","s described on Pavlovia’s websiteFootnote4, although there is no charge for running a pilot test, conducting a full study requires the purchase of participant credits (GBP 0.20 per participant) or an institutional license (GBP 1500 per year, with no participant limit).","","","","","","","","","","","","","","","","","","","","","","","","","","","","","","","","","","","","",""
"10.1037/pag0000644",2022,"Psychology and Aging","0882-7974",1.348,13,"United States","United States","United States","Meta-analysis and systematic reviews","https://openalex.org/T10206",NA,NA,NA,"National Institutes of Health || Sponsor name not included || Veterans Health Administration Office of Academic Affiliations || Minneapolis Center of Innovation","10.13039/100000002","U54 AG063546 || R61AG061903 || TPH 67-000 || CIN 13-406",NA,NA,list(id = "https://openalex.org/T10206", display_name = "Meta-analysis and systematic reviews", score = 0.994700014591217, subfield = list(id = "https://openalex.org/subfields/1804", display_name = "Statistics, Probability and Uncertainty"), field = list(id = "https://openalex.org/fields/18", display_name = "Decision Sciences"), domain = list(id = "https://openalex.org/domains/2", display_name = "Social Sciences")),"University of Minnesota, United States","University Hospitals of Cleveland, United States","Minnesota Department of Health, United States","https://openalex.org/I130238516","University of Minnesota","education","US","United States",NA,NA,NA,NA,"article","https://openalex.org/I2799343972","University Hospitals of Cleveland","healthcare","US","United States",NA,NA,NA,NA,"author-profile","https://openalex.org/I4210144997","Minnesota Department of Health","government","US","United States",NA,NA,NA,NA,"author-profile","10/24/2025 7:58:13","MME","https://doi.org/10.1037/pag0000644","We likewise present an example of a recent pilot pragmatic trial from our own work focused on implementation of dementia education in an established community volunteer program (Porchlight Project).","Refering to previous studies (e.g. ""a small pilot study yielded similar findings in children with ASD (Chong et al., 2021).""","","","","","","","","","","","","","","","","","","","","","","","","","","","","","","","","","","","","They say . We illustrate these recommendations in the context of a recent pilot pragmatic trial known as the Porchlight Project and they provide the reference but it was more about recommendations based on it. So it might be important to include but would need some discussion about it. ",""
"10.1016/j.brat.2021.103997",2021,"Behaviour Research and Therapy","0005-7967",2.022,2,"United Kingdom","United Kingdom","United Kingdom","Anxiety, Depression, Psychometrics, Treatment, Cognitive Processes","https://openalex.org/T10853",NA,NA,NA,"National Institute for Health Research || University of Reading","10.13039/501100000272 || 10.13039/501100000839",NA,NA,NA,list(id = "https://openalex.org/T10853", display_name = "Anxiety, Depression, Psychometrics, Treatment, Cognitive Processes", score = 0.999800026416779, subfield = list(id = "https://openalex.org/subfields/3205", display_name = "Experimental and Cognitive Psychology"), field = list(id = "https://openalex.org/fields/32", display_name = "Psychology"), domain = list(id = "https://openalex.org/domains/2", display_name = "Social Sciences")),"University of Birmingham, United Kingdom","University of Reading, United Kingdom","University of Oxford, United Kingdom","https://openalex.org/I79619799","University of Birmingham","education","GB","United Kingdom",NA,NA,NA,NA,"article","https://openalex.org/I71052956","University of Reading","education","GB","United Kingdom",NA,NA,NA,NA,"author-profile","https://openalex.org/I40120149","University of Oxford","education","GB","United Kingdom",NA,NA,NA,NA,"author-profile","10/24/2025 7:59:40","MME","https://doi.org/10.1016/j.brat.2021.103997","To ensure that the recordings reflected what might typically happen in a school environment, we showed a pilot recording to University students and used their feedback in subsequent recordings Then says  We would also like to thank Audrey Screen for her invaluable support with recruitment and during the pilot","We would also like to thank Audrey Screen for her invaluable support with recruitment and during the pilot.  o ensure that the recordings reflected what might typically happen in a school environment, we showed a pilot recording to University students and used their feedback in subsequent recordings. ","","","","","","","","","","","","","","","","","","","","","","","","","","","","","","","","","","","","",""
"10.1002/eat.23864",2022,"International Journal of Eating Disorders","0276-3478",1.468,8,"United States","United States","China","Eating Disorders and Behaviors","https://openalex.org/T10263",NA,NA,NA,"National Institute of Mental Health","10.13039/100000025","R01MH129478 || F31MH131262",NA,"<jats:title>Abstract</jats:title><jats:sec><jats:title>Objective</jats:title><jats:p>Adjunctive mobile health (mHealth) technologies offer promise for improving treatment response to enhanced cognitive‐behavior therapy (CBT‐E) among individuals with binge‐spectrum eating disorders, but research on the key “active” components of these technologies has been very limited. The present study will use a full factorial design to (1) evaluate the optimal combination of complexity of two commonly used mHealth components (i.e., self‐monitoring and microinterventions) alongside CBT‐E and (2) test whether the optimal complexity level of these interventions is moderated by baseline self‐regulation. Secondary aims of the present study include evaluating target engagement associated with each level of these intervention components and quantifying the component interaction effects (i.e., partially additive, fully additive, or synergistic effects).</jats:p></jats:sec><jats:sec><jats:title>Method</jats:title><jats:p>Two hundred and sixty‐four participants with binge‐spectrum eating disorders will be randomized to six treatment conditions determined by the combination of self‐monitoring condition (i.e., standard self‐monitoring or skills monitoring) and microinterventions condition (i.e., no microinterventions, automated microinterventions, or just‐in‐time adaptive interventions) as an augmentation to 16 sessions of CBT‐E. Treatment outcomes will be measured using the Eating Disorder Examination and compared by treatment condition using multilevel models.</jats:p></jats:sec><jats:sec><jats:title>Results</jats:title><jats:p>Results will clarify the “active” components in mHealth interventions for binge eating.</jats:p></jats:sec><jats:sec><jats:title>Discussion</jats:title><jats:p>The present study will provide critical insight into the efficacy of commonly used digital intervention components (i.e., skills monitoring and microinterventions) alongside CBT‐E. Furthermore, results of this study may inform personalization of digital intervention intensity based on patient profiles of self‐regulation.</jats:p></jats:sec><jats:sec><jats:title>Public Significance</jats:title><jats:p>This study will examine the relative effectiveness of commonly used components of application‐based interventions as an augmentation to cognitive‐behavioral therapy for binge eating. Findings from this study will inform the development of an optimized digital intervention for individuals with binge eating.</jats:p></jats:sec>",list(id = "https://openalex.org/T10263", display_name = "Eating Disorders and Behaviors", score = 1, subfield = list(id = "https://openalex.org/subfields/3203", display_name = "Clinical Psychology"), field = list(id = "https://openalex.org/fields/32", display_name = "Psychology"), domain = list(id = "https://openalex.org/domains/2", display_name = "Social Sciences")),"Drexel University, United States","Oregon Research Institute, United States","Minzu University of China, China","https://openalex.org/I72816309","Drexel University","education","US","United States",NA,NA,NA,NA,"article","https://openalex.org/I1322437667","Oregon Research Institute","nonprofit","US","United States",NA,NA,NA,NA,"author-profile","https://openalex.org/I145897649","Minzu University of China","education","CN","China",NA,NA,NA,NA,"author-profile","10/24/2025 8:11:03","MME","10.1002/eat.23864","Yes, the article states that there was a pilot study","","No","Yes, the article states that there is a preregistration","1","Empirical study(ies)","Experimental study, Randomized Controlled Trial (RCT)","Our pilot study identified a more modest decrease in self-monitoring during treatment, from an average of 3.31 entries per day in the first week of treatment to 2.13 entries per day during week 15 (Juarascio et al., 2022). 
As described previously, our pilot trial found that individuals with self-regulation deficits benefitted more from JITAIs during CBT-E than individuals without these difficulties (Presseller et al., 2022). 
Impulsivity and emotion dysregulation have been identified as aspects of self-regulation that are highly relevant for individuals with eating pathology (Lavender et al., 2015) and were predictive of individuals who responded particularly well to JITAIs in our pilot trial (Presseller et al., 2022); these two constructs will be used as markers of self-regulation deficits at baseline.
Based on our pilot study, we conservatively estimated a medium effect size (d = 0.5) for microintervention complexity. Our power analysis suggested a sample size of 210 (70 for each of the three complexity levels) to achieve 80% power with the significant level of 0.05 and five assessment points to detect a medium effect, assuming the ratio of the variability of level-1 coefficient to the variability of level-1 residual is at least one. ","“Pilot*” (study, experiment, test or similar; piloting; piloted)","Yes","One pilot study reported in the article (single study)","N/A","N/A","N/A","N/A","N/A","N/A","","Impulsivity and emotion dysregulation have been identified as aspects of self-regulation that are highly relevant for individuals with eating pathology (Lavender et al., 2015) and were predictive of individuals who responded particularly well to JITAIs in our pilot trial (Presseller et al., 2022); these two constructs will be used as markers of self-regulation deficits at baseline.","Had to check the previous article. No data from pilot is available.","","","Had to check previous study, no scripts are available. ","","","Had to check previous article, no pilot materials/methods were available.","","","No","","",NA,"","National Institute of Mental Health, Grant/Award Numbers: R01MH129478, F31MH131262; National Institute of Diabetes, Digestive, and Kidney Diseases, Grant/Award Number: K23DK124514","No, there is no conflict of interest statement","The authors have no conflicts of interest to disclose.","Well if no other study shares data, materials, scripts and so on then yes it is the best of a bad bunch but if others do share it. Then no, it is not a good example except for the methods written and results.","",""
